title,company,description,url
Data Analyst,Woolworths Group,"Seeking a data analyst with strong SQL skills to build dashboards and KPI reports for supply chain operations. Experience with Power BI and warehouse management systems preferred.",https://seek.com.au/job/1
Operations Analyst,Amazon,"Join our fulfillment operations team. You will analyse WMS data, build reporting tools, and drive process improvement across our distribution network. SQL and Excel required.",https://seek.com.au/job/2
Automation Analytics Specialist,Toll Group,"We need an automation analytics specialist to extract insights from SCADA and WCS platforms. Must have SQL and Power BI experience. Agile team environment.",https://seek.com.au/job/3
Junior Software Developer,TechCorp,"Looking for a Python and JavaScript developer to build web applications. Experience with React and Node.js required.",https://seek.com.au/job/4
Supply Chain Analyst,Coles Group,"Analyst role supporting supply chain planning and logistics reporting. Strong Excel, Google Sheets, and data analysis skills needed. Experience with 3PL and FMCG sector preferred.",https://seek.com.au/job/5
Marketing Manager,BrandCo,"Lead our digital marketing campaigns. Experience with social media, SEO, and Google Ads. Creative storytelling skills essential.",https://seek.com.au/job/6
Systems Analyst - Warehouse Technology,DHL,"Systems analyst to support WMS and automation system rollouts. Responsibilities include UAT coordination, SOP documentation, and stakeholder reporting. SQL knowledge a plus.",https://seek.com.au/job/7
